[
  {
    "siruta": "10",
    "nume": "JUDEȚUL ALBA",
    "cod_postal": "0",
    "judet_cod_numeric": "1",
    "siruta_parinte": "1",
    "tip": 40,
    "nivel": 1,
    "mediu": 0,
    "regiune": "7",
    "fsj": "1",
    "nuts": "RO121",
    "lau": null
  },
  {
    "siruta": "29",
    "nume": "JUDEȚUL ARAD",
    "cod_postal": "0",
    "judet_cod_numeric": "2",
    "siruta_parinte": "1",
    "tip": 40,
    "nivel": 1,
    "mediu": 0,
    "regiune": "5",
    "fsj": "2",
    "nuts": "RO421",
    "lau": null
  },
  {
    "siruta": "38",
    "nume": "JUDEȚUL ARGEȘ",
    "cod_postal": "0",
    "judet_cod_numeric": "3",
    "siruta_parinte": "1",
    "tip": 40,
    "nivel": 1,
    "mediu": 0,
    "regiune": "3",
    "fsj": "3",
    "nuts": "RO311",
    "lau": null
  },
  {
    "siruta": "47",
    "nume": "JUDEȚUL BACĂU",
    "cod_postal": "0",
    "judet_cod_numeric": "4",
    "siruta_parinte": "1",
    "tip": 40,
    "nivel": 1,
    "mediu": 0,
    "regiune": "1",
    "fsj": "4",
    "nuts": "RO211",
    "lau": null
  },
  {
    "siruta": "56",
    "nume": "JUDEȚUL BIHOR",
    "cod_postal": "0",
    "judet_cod_numeric": "5",
    "siruta_parinte": "1",
    "tip": 40,
    "nivel": 1,
    "mediu": 0,
    "regiune": "6",
    "fsj": "5",
    "nuts": "RO111",
    "lau": null
  },
  {
    "siruta": "65",
    "nume": "JUDEȚUL BISTRIȚA-NĂSĂUD",
    "cod_postal": "0",
    "judet_cod_numeric": "6",
    "siruta_parinte": "1",
    "tip": 40,
    "nivel": 1,
    "mediu": 0,
    "regiune": "6",
    "fsj": "6",
    "nuts": "RO112",
    "lau": null
  },
  {
    "siruta": "74",
    "nume": "JUDEȚUL BOTOȘANI",
    "cod_postal": "0",
    "judet_cod_numeric": "7",
    "siruta_parinte": "1",
    "tip": 40,
    "nivel": 1,
    "mediu": 0,
    "regiune": "1",
    "fsj": "7",
    "nuts": "RO212",
    "lau": null
  },
  {
    "siruta": "83",
    "nume": "JUDEȚUL BRAȘOV",
    "cod_postal": "0",
    "judet_cod_numeric": "8",
    "siruta_parinte": "1",
    "tip": 40,
    "nivel": 1,
    "mediu": 0,
    "regiune": "7",
    "fsj": "8",
    "nuts": "RO122",
    "lau": null
  },
  {
    "siruta": "92",
    "nume": "JUDEȚUL BRĂILA",
    "cod_postal": "0",
    "judet_cod_numeric": "9",
    "siruta_parinte": "1",
    "tip": 40,
    "nivel": 1,
    "mediu": 0,
    "regiune": "2",
    "fsj": "9",
    "nuts": "RO221",
    "lau": null
  },
  {
    "siruta": "109",
    "nume": "JUDEȚUL BUZĂU",
    "cod_postal": "0",
    "judet_cod_numeric": "10",
    "siruta_parinte": "1",
    "tip": 40,
    "nivel": 1,
    "mediu": 0,
    "regiune": "2",
    "fsj": "10",
    "nuts": "RO222",
    "lau": null
  },
  {
    "siruta": "118",
    "nume": "JUDEȚUL CARAȘ-SEVERIN",
    "cod_postal": "0",
    "judet_cod_numeric": "11",
    "siruta_parinte": "1",
    "tip": 40,
    "nivel": 1,
    "mediu": 0,
    "regiune": "5",
    "fsj": "11",
    "nuts": "RO422",
    "lau": null
  },
  {
    "siruta": "127",
    "nume": "JUDEȚUL CLUJ",
    "cod_postal": "0",
    "judet_cod_numeric": "12",
    "siruta_parinte": "1",
    "tip": 40,
    "nivel": 1,
    "mediu": 0,
    "regiune": "6",
    "fsj": "13",
    "nuts": "RO113",
    "lau": null
  },
  {
    "siruta": "136",
    "nume": "JUDEȚUL CONSTANȚA",
    "cod_postal": "0",
    "judet_cod_numeric": "13",
    "siruta_parinte": "1",
    "tip": 40,
    "nivel": 1,
    "mediu": 0,
    "regiune": "2",
    "fsj": "14",
    "nuts": "RO223",
    "lau": null
  },
  {
    "siruta": "145",
    "nume": "JUDEȚUL COVASNA",
    "cod_postal": "0",
    "judet_cod_numeric": "14",
    "siruta_parinte": "1",
    "tip": 40,
    "nivel": 1,
    "mediu": 0,
    "regiune": "7",
    "fsj": "15",
    "nuts": "RO123",
    "lau": null
  },
  {
    "siruta": "154",
    "nume": "JUDEȚUL DÂMBOVIȚA",
    "cod_postal": "0",
    "judet_cod_numeric": "15",
    "siruta_parinte": "1",
    "tip": 40,
    "nivel": 1,
    "mediu": 0,
    "regiune": "3",
    "fsj": "16",
    "nuts": "RO313",
    "lau": null
  },
  {
    "siruta": "163",
    "nume": "JUDEȚUL DOLJ",
    "cod_postal": "0",
    "judet_cod_numeric": "16",
    "siruta_parinte": "1",
    "tip": 40,
    "nivel": 1,
    "mediu": 0,
    "regiune": "4",
    "fsj": "17",
    "nuts": "RO411",
    "lau": null
  },
  {
    "siruta": "172",
    "nume": "JUDEȚUL GALAȚI",
    "cod_postal": "0",
    "judet_cod_numeric": "17",
    "siruta_parinte": "1",
    "tip": 40,
    "nivel": 1,
    "mediu": 0,
    "regiune": "2",
    "fsj": "18",
    "nuts": "RO224",
    "lau": null
  },
  {
    "siruta": "181",
    "nume": "JUDEȚUL GORJ",
    "cod_postal": "0",
    "judet_cod_numeric": "18",
    "siruta_parinte": "1",
    "tip": 40,
    "nivel": 1,
    "mediu": 0,
    "regiune": "4",
    "fsj": "20",
    "nuts": "RO412",
    "lau": null
  },
  {
    "siruta": "190",
    "nume": "JUDEȚUL HARGHITA",
    "cod_postal": "0",
    "judet_cod_numeric": "19",
    "siruta_parinte": "1",
    "tip": 40,
    "nivel": 1,
    "mediu": 0,
    "regiune": "7",
    "fsj": "21",
    "nuts": "RO124",
    "lau": null
  },
  {
    "siruta": "207",
    "nume": "JUDEȚUL HUNEDOARA",
    "cod_postal": "0",
    "judet_cod_numeric": "20",
    "siruta_parinte": "1",
    "tip": 40,
    "nivel": 1,
    "mediu": 0,
    "regiune": "5",
    "fsj": "22",
    "nuts": "RO423",
    "lau": null
  },
  {
    "siruta": "216",
    "nume": "JUDEȚUL IALOMIȚA",
    "cod_postal": "0",
    "judet_cod_numeric": "21",
    "siruta_parinte": "1",
    "tip": 40,
    "nivel": 1,
    "mediu": 0,
    "regiune": "3",
    "fsj": "23",
    "nuts": "RO315",
    "lau": null
  },
  {
    "siruta": "225",
    "nume": "JUDEȚUL IAȘI",
    "cod_postal": "0",
    "judet_cod_numeric": "22",
    "siruta_parinte": "1",
    "tip": 40,
    "nivel": 1,
    "mediu": 0,
    "regiune": "1",
    "fsj": "24",
    "nuts": "RO213",
    "lau": null
  },
  {
    "siruta": "234",
    "nume": "JUDEȚUL ILFOV",
    "cod_postal": "0",
    "judet_cod_numeric": "23",
    "siruta_parinte": "1",
    "tip": 40,
    "nivel": 1,
    "mediu": 0,
    "regiune": "8",
    "fsj": "25",
    "nuts": "RO322",
    "lau": null
  },
  {
    "siruta": "243",
    "nume": "JUDEȚUL MARAMUREȘ",
    "cod_postal": "0",
    "judet_cod_numeric": "24",
    "siruta_parinte": "1",
    "tip": 40,
    "nivel": 1,
    "mediu": 0,
    "regiune": "6",
    "fsj": "26",
    "nuts": "RO114",
    "lau": null
  },
  {
    "siruta": "252",
    "nume": "JUDEȚUL MEHEDINȚI",
    "cod_postal": "0",
    "judet_cod_numeric": "25",
    "siruta_parinte": "1",
    "tip": 40,
    "nivel": 1,
    "mediu": 0,
    "regiune": "4",
    "fsj": "27",
    "nuts": "RO413",
    "lau": null
  },
  {
    "siruta": "261",
    "nume": "JUDEȚUL MUREȘ",
    "cod_postal": "0",
    "judet_cod_numeric": "26",
    "siruta_parinte": "1",
    "tip": 40,
    "nivel": 1,
    "mediu": 0,
    "regiune": "7",
    "fsj": "28",
    "nuts": "RO125",
    "lau": null
  },
  {
    "siruta": "270",
    "nume": "JUDEȚUL NEAMȚ",
    "cod_postal": "0",
    "judet_cod_numeric": "27",
    "siruta_parinte": "1",
    "tip": 40,
    "nivel": 1,
    "mediu": 0,
    "regiune": "1",
    "fsj": "29",
    "nuts": "RO214",
    "lau": null
  },
  {
    "siruta": "289",
    "nume": "JUDEȚUL OLT",
    "cod_postal": "0",
    "judet_cod_numeric": "28",
    "siruta_parinte": "1",
    "tip": 40,
    "nivel": 1,
    "mediu": 0,
    "regiune": "4",
    "fsj": "30",
    "nuts": "RO414",
    "lau": null
  },
  {
    "siruta": "298",
    "nume": "JUDEȚUL PRAHOVA",
    "cod_postal": "0",
    "judet_cod_numeric": "29",
    "siruta_parinte": "1",
    "tip": 40,
    "nivel": 1,
    "mediu": 0,
    "regiune": "3",
    "fsj": "31",
    "nuts": "RO316",
    "lau": null
  },
  {
    "siruta": "305",
    "nume": "JUDEȚUL SATU MARE",
    "cod_postal": "0",
    "judet_cod_numeric": "30",
    "siruta_parinte": "1",
    "tip": 40,
    "nivel": 1,
    "mediu": 0,
    "regiune": "6",
    "fsj": "32",
    "nuts": "RO115",
    "lau": null
  },
  {
    "siruta": "314",
    "nume": "JUDEȚUL SĂLAJ",
    "cod_postal": "0",
    "judet_cod_numeric": "31",
    "siruta_parinte": "1",
    "tip": 40,
    "nivel": 1,
    "mediu": 0,
    "regiune": "6",
    "fsj": "33",
    "nuts": "RO116",
    "lau": null
  },
  {
    "siruta": "323",
    "nume": "JUDEȚUL SIBIU",
    "cod_postal": "0",
    "judet_cod_numeric": "32",
    "siruta_parinte": "1",
    "tip": 40,
    "nivel": 1,
    "mediu": 0,
    "regiune": "7",
    "fsj": "34",
    "nuts": "RO126",
    "lau": null
  },
  {
    "siruta": "332",
    "nume": "JUDEȚUL SUCEAVA",
    "cod_postal": "0",
    "judet_cod_numeric": "33",
    "siruta_parinte": "1",
    "tip": 40,
    "nivel": 1,
    "mediu": 0,
    "regiune": "1",
    "fsj": "35",
    "nuts": "RO215",
    "lau": null
  },
  {
    "siruta": "341",
    "nume": "JUDEȚUL TELEORMAN",
    "cod_postal": "0",
    "judet_cod_numeric": "34",
    "siruta_parinte": "1",
    "tip": 40,
    "nivel": 1,
    "mediu": 0,
    "regiune": "3",
    "fsj": "36",
    "nuts": "RO317",
    "lau": null
  },
  {
    "siruta": "350",
    "nume": "JUDEȚUL TIMIȘ",
    "cod_postal": "0",
    "judet_cod_numeric": "35",
    "siruta_parinte": "1",
    "tip": 40,
    "nivel": 1,
    "mediu": 0,
    "regiune": "5",
    "fsj": "37",
    "nuts": "RO424",
    "lau": null
  },
  {
    "siruta": "369",
    "nume": "JUDEȚUL TULCEA",
    "cod_postal": "0",
    "judet_cod_numeric": "36",
    "siruta_parinte": "1",
    "tip": 40,
    "nivel": 1,
    "mediu": 0,
    "regiune": "2",
    "fsj": "38",
    "nuts": "RO225",
    "lau": null
  },
  {
    "siruta": "378",
    "nume": "JUDEȚUL VASLUI",
    "cod_postal": "0",
    "judet_cod_numeric": "37",
    "siruta_parinte": "1",
    "tip": 40,
    "nivel": 1,
    "mediu": 0,
    "regiune": "1",
    "fsj": "39",
    "nuts": "RO216",
    "lau": null
  },
  {
    "siruta": "387",
    "nume": "JUDEȚUL VÂLCEA",
    "cod_postal": "0",
    "judet_cod_numeric": "38",
    "siruta_parinte": "1",
    "tip": 40,
    "nivel": 1,
    "mediu": 0,
    "regiune": "4",
    "fsj": "40",
    "nuts": "RO415",
    "lau": null
  },
  {
    "siruta": "396",